{
  "$schema": "http://json-schema.org/draft-07/schema#",
  "title": "FileMate QA Pairs v1",
  "type": "array",
  "items": {
    "type": "object",
    "required": ["id", "question", "reference", "synthetic"],
    "properties": {
      "id": { "type": "string" },
      "source_id": { "type": "string" },
      "topic": { "type": "string" },
      "question": { "type": "string" },
      "gold_chunk_ids": { "type": "array", "items": { "type": "string" } },
      "reference": { "type": "string" },
      "synthetic": { "type": "boolean" },
      "status": { "enum": ["draft", "labeled", "approved"] },
      "created_at": { "type": "string" }
    }
  }
}
