[
  {
    "id": "syn-001",
    "source_id": "synthetic-source",
    "topic": "操作系统",
    "question": "进程与线程的区别是什么？",
    "gold_chunk_ids": [],
    "reference": "进程是资源分配单位，线程是 CPU 调度单位；同进程内线程共享地址空间。",
    "synthetic": true,
    "status": "draft",
    "created_at": "2026-08-23T17:17:44+00:00"
  },
  {
    "id": "syn-002",
    "source_id": "synthetic-source",
    "topic": "计算机网络",
    "question": "TCP 与 UDP 的主要区别是什么？",
    "gold_chunk_ids": [],
    "reference": "TCP 面向连接、可靠、有序；UDP 无连接、不可靠、开销小。",
    "synthetic": true,
    "status": "draft",
    "created_at": "2026-08-23T17:17:44+00:00"
  },
  {
    "id": "syn-003",
    "source_id": "synthetic-source",
    "topic": "数据库",
    "question": "ACID 分别指什么？",
    "gold_chunk_ids": [],
    "reference": "原子性、一致性、隔离性、持久性。",
    "synthetic": true,
    "status": "draft",
    "created_at": "2026-08-23T17:17:44+00:00"
  },
  {
    "id": "syn-004",
    "source_id": "synthetic-source",
    "topic": "算法",
    "question": "稳定排序和不稳定排序有什么区别？",
    "gold_chunk_ids": [],
    "reference": "稳定排序保持相等元素的原始相对顺序。",
    "synthetic": true,
    "status": "draft",
    "created_at": "2026-08-23T17:17:44+00:00"
  },
  {
    "id": "syn-005",
    "source_id": "synthetic-source",
    "topic": "机器学习",
    "question": "过拟合如何缓解？",
    "gold_chunk_ids": [],
    "reference": "增加数据、正则化、早停、交叉验证。",
    "synthetic": true,
    "status": "draft",
    "created_at": "2026-08-23T17:17:44+00:00"
  },
  {
    "id": "syn-006",
    "source_id": "synthetic-source",
    "topic": "软件工程",
    "question": "单元测试和集成测试的区别是什么？",
    "gold_chunk_ids": [],
    "reference": "单元测试验证单一模块，集成测试验证模块间协作。",
    "synthetic": true,
    "status": "draft",
    "created_at": "2026-08-23T17:17:44+00:00"
  },
  {
    "id": "syn-007",
    "source_id": "synthetic-source",
    "topic": "数学",
    "question": "导数的几何意义是什么？",
    "gold_chunk_ids": [],
    "reference": "导数是函数在某点的切线斜率。",
    "synthetic": true,
    "status": "draft",
    "created_at": "2026-08-23T17:17:44+00:00"
  },
  {
    "id": "syn-008",
    "source_id": "synthetic-source",
    "topic": "编译原理",
    "question": "词法分析和语法分析的区别是什么？",
    "gold_chunk_ids": [],
    "reference": "词法分析生成 token，语法分析构建语法树。",
    "synthetic": true,
    "status": "draft",
    "created_at": "2026-08-23T17:17:44+00:00"
  },
  {
    "id": "syn-009",
    "source_id": "synthetic-source",
    "topic": "安全",
    "question": "哈希函数和加密的区别是什么？",
    "gold_chunk_ids": [],
    "reference": "哈希不可逆，加密可逆；哈希用于完整性，加密用于机密性。",
    "synthetic": true,
    "status": "draft",
    "created_at": "2026-08-23T17:17:44+00:00"
  },
  {
    "id": "syn-010",
    "source_id": "synthetic-source",
    "topic": "项目管理",
    "question": "什么是关键路径？",
    "gold_chunk_ids": [],
    "reference": "项目中最长依赖路径，决定最短工期。",
    "synthetic": true,
    "status": "draft",
    "created_at": "2026-08-23T17:17:44+00:00"
  },
  {
    "id": "syn-011",
    "source_id": "synthetic-source",
    "topic": "操作系统",
    "question": "进程与线程的区别是什么？",
    "gold_chunk_ids": [],
    "reference": "进程是资源分配单位，线程是 CPU 调度单位；同进程内线程共享地址空间。",
    "synthetic": true,
    "status": "draft",
    "created_at": "2026-08-23T17:17:44+00:00"
  },
  {
    "id": "syn-012",
    "source_id": "synthetic-source",
    "topic": "计算机网络",
    "question": "TCP 与 UDP 的主要区别是什么？",
    "gold_chunk_ids": [],
    "reference": "TCP 面向连接、可靠、有序；UDP 无连接、不可靠、开销小。",
    "synthetic": true,
    "status": "draft",
    "created_at": "2026-08-23T17:17:44+00:00"
  },
  {
    "id": "syn-013",
    "source_id": "synthetic-source",
    "topic": "数据库",
    "question": "ACID 分别指什么？",
    "gold_chunk_ids": [],
    "reference": "原子性、一致性、隔离性、持久性。",
    "synthetic": true,
    "status": "draft",
    "created_at": "2026-08-23T17:17:44+00:00"
  },
  {
    "id": "syn-014",
    "source_id": "synthetic-source",
    "topic": "算法",
    "question": "稳定排序和不稳定排序有什么区别？",
    "gold_chunk_ids": [],
    "reference": "稳定排序保持相等元素的原始相对顺序。",
    "synthetic": true,
    "status": "draft",
    "created_at": "2026-08-23T17:17:44+00:00"
  },
  {
    "id": "syn-015",
    "source_id": "synthetic-source",
    "topic": "机器学习",
    "question": "过拟合如何缓解？",
    "gold_chunk_ids": [],
    "reference": "增加数据、正则化、早停、交叉验证。",
    "synthetic": true,
    "status": "draft",
    "created_at": "2026-08-23T17:17:44+00:00"
  },
  {
    "id": "syn-016",
    "source_id": "synthetic-source",
    "topic": "软件工程",
    "question": "单元测试和集成测试的区别是什么？",
    "gold_chunk_ids": [],
    "reference": "单元测试验证单一模块，集成测试验证模块间协作。",
    "synthetic": true,
    "status": "draft",
    "created_at": "2026-08-23T17:17:44+00:00"
  },
  {
    "id": "syn-017",
    "source_id": "synthetic-source",
    "topic": "数学",
    "question": "导数的几何意义是什么？",
    "gold_chunk_ids": [],
    "reference": "导数是函数在某点的切线斜率。",
    "synthetic": true,
    "status": "draft",
    "created_at": "2026-08-23T17:17:44+00:00"
  },
  {
    "id": "syn-018",
    "source_id": "synthetic-source",
    "topic": "编译原理",
    "question": "词法分析和语法分析的区别是什么？",
    "gold_chunk_ids": [],
    "reference": "词法分析生成 token，语法分析构建语法树。",
    "synthetic": true,
    "status": "draft",
    "created_at": "2026-08-23T17:17:44+00:00"
  },
  {
    "id": "syn-019",
    "source_id": "synthetic-source",
    "topic": "安全",
    "question": "哈希函数和加密的区别是什么？",
    "gold_chunk_ids": [],
    "reference": "哈希不可逆，加密可逆；哈希用于完整性，加密用于机密性。",
    "synthetic": true,
    "status": "draft",
    "created_at": "2026-08-23T17:17:44+00:00"
  },
  {
    "id": "syn-020",
    "source_id": "synthetic-source",
    "topic": "项目管理",
    "question": "什么是关键路径？",
    "gold_chunk_ids": [],
    "reference": "项目中最长依赖路径，决定最短工期。",
    "synthetic": true,
    "status": "draft",
    "created_at": "2026-08-23T17:17:44+00:00"
  },
  {
    "id": "syn-021",
    "source_id": "synthetic-source",
    "topic": "操作系统",
    "question": "进程与线程的区别是什么？",
    "gold_chunk_ids": [],
    "reference": "进程是资源分配单位，线程是 CPU 调度单位；同进程内线程共享地址空间。",
    "synthetic": true,
    "status": "draft",
    "created_at": "2026-08-23T17:17:44+00:00"
  },
  {
    "id": "syn-022",
    "source_id": "synthetic-source",
    "topic": "计算机网络",
    "question": "TCP 与 UDP 的主要区别是什么？",
    "gold_chunk_ids": [],
    "reference": "TCP 面向连接、可靠、有序；UDP 无连接、不可靠、开销小。",
    "synthetic": true,
    "status": "draft",
    "created_at": "2026-08-23T17:17:44+00:00"
  },
  {
    "id": "syn-023",
    "source_id": "synthetic-source",
    "topic": "数据库",
    "question": "ACID 分别指什么？",
    "gold_chunk_ids": [],
    "reference": "原子性、一致性、隔离性、持久性。",
    "synthetic": true,
    "status": "draft",
    "created_at": "2026-08-23T17:17:44+00:00"
  },
  {
    "id": "syn-024",
    "source_id": "synthetic-source",
    "topic": "算法",
    "question": "稳定排序和不稳定排序有什么区别？",
    "gold_chunk_ids": [],
    "reference": "稳定排序保持相等元素的原始相对顺序。",
    "synthetic": true,
    "status": "draft",
    "created_at": "2026-08-23T17:17:44+00:00"
  },
  {
    "id": "syn-025",
    "source_id": "synthetic-source",
    "topic": "机器学习",
    "question": "过拟合如何缓解？",
    "gold_chunk_ids": [],
    "reference": "增加数据、正则化、早停、交叉验证。",
    "synthetic": true,
    "status": "draft",
    "created_at": "2026-08-23T17:17:44+00:00"
  },
  {
    "id": "syn-026",
    "source_id": "synthetic-source",
    "topic": "软件工程",
    "question": "单元测试和集成测试的区别是什么？",
    "gold_chunk_ids": [],
    "reference": "单元测试验证单一模块，集成测试验证模块间协作。",
    "synthetic": true,
    "status": "draft",
    "created_at": "2026-08-23T17:17:44+00:00"
  },
  {
    "id": "syn-027",
    "source_id": "synthetic-source",
    "topic": "数学",
    "question": "导数的几何意义是什么？",
    "gold_chunk_ids": [],
    "reference": "导数是函数在某点的切线斜率。",
    "synthetic": true,
    "status": "draft",
    "created_at": "2026-08-23T17:17:44+00:00"
  },
  {
    "id": "syn-028",
    "source_id": "synthetic-source",
    "topic": "编译原理",
    "question": "词法分析和语法分析的区别是什么？",
    "gold_chunk_ids": [],
    "reference": "词法分析生成 token，语法分析构建语法树。",
    "synthetic": true,
    "status": "draft",
    "created_at": "2026-08-23T17:17:44+00:00"
  },
  {
    "id": "syn-029",
    "source_id": "synthetic-source",
    "topic": "安全",
    "question": "哈希函数和加密的区别是什么？",
    "gold_chunk_ids": [],
    "reference": "哈希不可逆，加密可逆；哈希用于完整性，加密用于机密性。",
    "synthetic": true,
    "status": "draft",
    "created_at": "2026-08-23T17:17:44+00:00"
  },
  {
    "id": "syn-030",
    "source_id": "synthetic-source",
    "topic": "项目管理",
    "question": "什么是关键路径？",
    "gold_chunk_ids": [],
    "reference": "项目中最长依赖路径，决定最短工期。",
    "synthetic": true,
    "status": "draft",
    "created_at": "2026-08-23T17:17:44+00:00"
  }
]
